Activity ID,Activity Date,Activity Name,Activity Type,Activity Description,Elapsed Time,Distance,Filename,Athlete Weight,Bike Weight,Elapsed Time,Moving Time,Distance,Max Speed,Elevation Gain,Elevation Loss,Elevation Low,Elevation High,Max Grade,Average Grade,Average Watts,Calories,Average Temperature
378834607,"Aug 27, 2015, 9:39:36 AM",Rollin with Rich,Ride,"We had a fantastic final rest day in Gander yesterday with Rich and Paul. Got a little lake swim in, had some beers and burgers and coffee... a classic summer day!

This morning we got an early start as we had a large day, and Rich decided to join us for the first 65km or so, then turn back and ride home, because he's a beast like that. He also did it fixed. 

After Rich left us at Splash and Putt, Newfoundland's premiere water park (sadly) we turned south, directly into the wind, and tackled the rolling hills of Terra Nova park. The temps were good, but in general today was a rough day. 150km, 1500m, and a headwind, are a tiring combo.

This evening we're in Clarenville, which is about 200km west of our final destination. I saw the 200km market today actually. We're staying with another Richard, and his wife Rebecca, who made us a delicious dinner. 

Two more sleeps!",35841,151.46,activities/427110291.fit.gz,77,44,35841,24528,151461,15.39999962,1543,,-74.59999847,115,18.5,-0.097054802,159.0359955,4349.431152,19
379625064,"Aug 28, 2015, 12:41:29 PM",Hubert the Cuban,Ride,"I want to write a scathing review of today's ride, it was completely terrible... headwind, rain, bad shoulder, broken spoke, isolation, cold, dirt road, etc etc.

But some parts were still fun, like having Church roll out of Clarenville with us, and being done.

If you're reading this and debating riding across Canada, first, stop it. It's not going to be as fun as you're expecting. Second, don't bother riding across Newfoundland. Vancouver to Halifax is just fine. If you must, take the Argentia ferry and skip most of NL. Spend those days in the Yukon, or PEI, or nearly anywhere else except northern Ontario.

Emily flew overhead today, from Vancouver to St. John's in about 10 hours. That took me 10 weeks. Planes are fast. But they can't run on granola bars.

I'm tired, and excited, and happy. Tomorrow should be fun :)",33742,132.95,activities/427941609.fit.gz,77,44,33742,23437,132951,15,1499,,0.200000003,204.3999939,18,0.095674098,155.0339966,4051.387939,16
380258736,"Aug 29, 2015, 12:34:49 PM","Day 70: The end. St. John's, NL",Ride,"What a roller coaster, in every facet. Uneventful final post. It wasn't revolutionary. It wasn't life changing. It was a lot of cycling. ",16961,74.03,activities/428607017.fit.gz,76,44,16961,11947,74033.29688,14.5,664,,-6.599999905,223.1999969,15.5,-0.181539997,146.529007,1951.898926,22